{
  "version": "run_record.v1",
  "run_id": "run_yyyymmdd_hhmmss_shortname",
  "created_at_utc": "2026-02-25T00:00:00Z",
  "git": {
    "commit": "0123456789abcdef0123456789abcdef01234567",
    "dirty": false
  },
  "dataset_id": "ds_yyyymmdd_name_v1",
  "config": {
    "path": "configs/exp/default.yaml",
    "sha256": "0000000000000000000000000000000000000000000000000000000000000000"
  },
  "seed": 42,
  "environment": {
    "os": "ubuntu-24.04",
    "cpu": "x86_64",
    "ram_gb": 64,
    "toolchain": {
      "rustc": "1.78.0",
      "cargo": "1.78.0"
    }
  },
  "timing": {
    "start_utc": "2026-02-25T00:00:00Z",
    "end_utc": "2026-02-25T00:10:00Z"
  },
  "metrics": {
    "mrr_at_10": 0.0,
    "ndcg_at_10": 0.0,
    "recall_at_10": 0.0,
    "tool_calls_per_task": 0.0,
    "stdout_bytes_per_task": 0.0,
    "ttfc_ms_p50": 0.0
  },
  "artifacts": {
    "raw_metrics_path": "artifacts/experiments/runs/run_yyyymmdd_hhmmss_shortname/metrics.json",
    "logs_path": "artifacts/experiments/runs/run_yyyymmdd_hhmmss_shortname/logs.txt",
    "summary_path": "artifacts/experiments/summaries/run_yyyymmdd_hhmmss_shortname.md"
  },
  "status": "success",
  "notes": "Add anomaly notes, failures, and reproducibility comments."
}
